### ISSUE TITLE
No graph data (softflowd)

### ISSUE THREAD

**Issue by wastemans** [grafolean/grafolean#54]
**Steps To Reproduce**
1. Bring up the docker images as written in the guide
2. Set up a brand new DB
3. Go into monitored entities, and see the exporter is listed, enable it as per netflow guide
4. Wait (in my case 12 hours)
5. Check the docker logs:

> 09:42:43 | netflow ~ # docker logs --since 5m -f grafolean-netflow-bot
> 2024-11-06 09:38:10.003 | INF | Running job "job_maint_suggest_entities (trigger: <grafoleancollector.collector.MultipleIntervalsTrigger object at 0x7fd06ca58828>, next run at: 2024-11-06 09:40:10 UTC)" (scheduled at 2024-11-06 09:38:10+00:00)
> 2024-11-06 09:38:10.004 | INF | MAINT: Maintenance started - making suggestions for device entities
> 2024-11-06 09:38:10.144 | INF | MAINT: We already know exporter [10.1.1.10]
> 2024-11-06 09:38:10.145 | INF | MAINT: Maintenance finished (device entities suggestions).
> 2024-11-06 09:38:10.145 | INF | Job "job_maint_suggest_entities (trigger: <grafoleancollector.collector.MultipleIntervalsTrigger object at 0x7fd06ca58828>, next run at: 2024-11-06 09:40:10 UTC)" executed successfully
> 2024-11-06 09:38:42.003 | INF | Running job "NetFlowBot.job_perform_account_aggr (trigger: <grafoleancollector.collector.MultipleIntervalsTrigger object at 0x7fd06af40f78>, next run at: 2024-11-06 09:39:42 UTC)" (scheduled at 2024-11-06 09:38:42+00:00)
> 2024-11-06 09:38:42.004 | INF | Starting 1min aggregation job for account 43197518...
> 2024-11-06 09:38:42.007 | INF | No netflow data found for job aggr/1min/43197518, skipping.
> 2024-11-06 09:38:42.007 | INF | Job "NetFlowBot.job_perform_account_aggr (trigger: <grafoleancollector.collector.MultipleIntervalsTrigger object at 0x7fd06af40f78>, next run at: 2024-11-06 09:39:42 UTC)" executed successfully
> 2024-11-06 09:39:42.004 | INF | Running job "NetFlowBot.job_perform_account_aggr (trigger: <grafoleancollector.collector.MultipleIntervalsTrigger object at 0x7fd06af40fc0>, next run at: 2024-11-06 09:40:42 UTC)" (scheduled at 2024-11-06 09:39:42+00:00)
> 2024-11-06 09:39:42.004 | INF | Starting 1min aggregation job for account 43197518...
> 2024-11-06 09:39:42.008 | INF | No netflow data found for job aggr/1min/43197518, skipping.
> 2024-11-06 09:39:42.008 | INF | Job "NetFlowBot.job_perform_account_aggr (trigger: <grafoleancollector.collector.MultipleIntervalsTrigger object at 0x7fd06af40fc0>, next run at: 2024-11-06 09:40:42 UTC)" executed successfully
> 2024-11-06 09:40:10.004 | INF | Running job "job_maint_suggest_entities (trigger: <grafoleancollector.collector.MultipleIntervalsTrigger object at 0x7fd06afcb120>, next run at: 2024-11-06 09:42:10 UTC)" (scheduled at 2024-11-06 09:40:10+00:00)
> 2024-11-06 09:40:10.004 | INF | MAINT: Maintenance started - making suggestions for device entities
> 2024-11-06 09:40:10.140 | INF | MAINT: We already know exporter [10.1.1.10]
> 2024-11-06 09:40:10.140 | INF | MAINT: Maintenance finished (device entities suggestions).
> 2024-11-06 09:40:10.141 | INF | Job "job_maint_suggest_entities (trigger: <grafoleancollector.collector.MultipleIntervalsTrigger object at 0x7fd06afcb120>, next run at: 2024-11-06 09:42:10 UTC)" executed successfully
> 2024-11-06 09:40:42.004 | INF | Running job "NetFlowBot.job_perform_account_aggr (trigger: <grafoleancollector.collector.MultipleIntervalsTrigger object at 0x7fd06af5ae10>, next run at: 2024-11-06 09:41:42 UTC)" (scheduled at 2024-11-06 09:40:42+00:00)
> 2024-11-06 09:40:42.004 | INF | Starting 1min aggregation job for account 43197518...
> 2024-11-06 09:40:42.007 | INF | No netflow data found for job aggr/1min/43197518, skipping.
> 2024-11-06 09:40:42.007 | INF | Job "NetFlowBot.job_perform_account_aggr (trigger: <grafoleancollector.collector.MultipleIntervalsTrigger object at 0x7fd06af5ae10>, next run at: 2024-11-06 09:41:42 UTC)" executed successfully
> 2024-11-06 09:41:42.004 | INF | Running job "NetFlowBot.job_perform_account_aggr (trigger: <grafoleancollector.collector.MultipleIntervalsTrigger object at 0x7fd06ca58870>, next run at: 2024-11-06 09:42:42 UTC)" (scheduled at 2024-11-06 09:41:42+00:00)
> 2024-11-06 09:41:42.004 | INF | Starting 1min aggregation job for account 43197518...
> 2024-11-06 09:41:42.007 | INF | No netflow data found for job aggr/1min/43197518, skipping.
> 2024-11-06 09:41:42.007 | INF | Job "NetFlowBot.job_perform_account_aggr (trigger: <grafoleancollector.collector.MultipleIntervalsTrigger object at 0x7fd06ca58870>, next run at: 2024-11-06 09:42:42 UTC)" executed successfully
> 2024-11-06 09:42:10.003 | INF | Running job "job_maint_suggest_entities (trigger: <grafoleancollector.collector.MultipleIntervalsTrigger object at 0x7fd06afc7a20>, next run at: 2024-11-06 09:44:10 UTC)" (scheduled at 2024-11-06 09:42:10+00:00)
> 2024-11-06 09:42:10.004 | INF | MAINT: Maintenance started - making suggestions for device entities
> 2024-11-06 09:42:10.151 | INF | MAINT: We already know exporter [10.1.1.10]
> 2024-11-06 09:42:10.151 | INF | MAINT: Maintenance finished (device entities suggestions).
> 2024-11-06 09:42:10.152 | INF | Job "job_maint_suggest_entities (trigger: <grafoleancollector.collector.MultipleIntervalsTrigger object at 0x7fd06afc7a20>, next run at: 2024-11-06 09:44:10 UTC)" executed successfully
> 2024-11-06 09:42:42.003 | INF | Running job "NetFlowBot.job_perform_account_aggr (trigger: <grafoleancollector.collector.MultipleIntervalsTrigger object at 0x7fd06af405a0>, next run at: 2024-11-06 09:43:42 UTC)" (scheduled at 2024-11-06 09:42:42+00:00)
> 2024-11-06 09:42:42.004 | INF | Starting 1min aggregation job for account 43197518...
> 2024-11-06 09:42:42.007 | INF | No netflow data found for job aggr/1min/43197518, skipping.
> 2024-11-06 09:42:42.007 | INF | Job "NetFlowBot.job_perform_account_aggr (trigger: <grafoleancollector.collector.MultipleIntervalsTrigger object at 0x7fd06af405a0>, next run at: 2024-11-06 09:43:42 UTC)" executed successfully

**Whan went wrong**
There's nothing in the dashboard.

**Expected behavior**
Some nice graphs :-)

**Software versions:**
 - Docker version Docker version 27.3.1, build ce12230
 - docker-compose version 1.29.2-6.3
 - Browser Firefox, ungoogled-chromium
 - Grafolean Version v0.5.0

**Additional context**
softflowd is exporting with these params from pfsense:
![image](https://github.com/user-attachments/assets/ab8ce4b0-75cd-42e0-bfba-e10593f677d1)

**Comment by wastemans** [comment]
Ah also, I can see packets hitting the netflow server, though it does seem admittedly slim:

`09:51:33 | netflow ~ # tcpdump -i eth0 port 2055 -nN
tcpdump: verbose output suppressed, use -v[v]... for full protocol decode
listening on eth0, link-type EN10MB (Ethernet), snapshot length 262144 bytes
09:51:53.329977 IP 10.1.1.10.26125 > 10.1.1.70.2055: UDP, length 500
09:51:53.330332 IP 10.1.1.10.26125 > 10.1.1.70.2055: UDP, length 1356
09:51:53.330342 IP 10.1.1.10.26125 > 10.1.1.70.2055: UDP, length 1412
09:51:53.330345 IP 10.1.1.10.26125 > 10.1.1.70.2055: UDP, length 1364
09:51:53.330346 IP 10.1.1.10.26125 > 10.1.1.70.2055: UDP, length 1396
09:51:53.330348 IP 10.1.1.10.26125 > 10.1.1.70.2055: UDP, length 1364
09:51:53.330350 IP 10.1.1.10.26125 > 10.1.1.70.2055: UDP, length 1380
09:51:53.330352 IP 10.1.1.10.26125 > 10.1.1.70.2055: UDP, length 1360
09:51:53.330421 IP 10.1.1.10.26125 > 10.1.1.70.2055: UDP, length 1364
09:51:53.330424 IP 10.1.1.10.26125 > 10.1.1.70.2055: UDP, length 1344
09:51:53.330431 IP 10.1.1.10.26125 > 10.1.1.70.2055: UDP, length 1392
09:51:53.330492 IP 10.1.1.10.26125 > 10.1.1.70.2055: UDP, length 1364
09:51:53.330494 IP 10.1.1.10.26125 > 10.1.1.70.2055: UDP, length 1364
09:51:53.330539 IP 10.1.1.10.26125 > 10.1.1.70.2055: UDP, length 1364
09:51:53.330572 IP 10.1.1.10.26125 > 10.1.1.70.2055: UDP, length 1412
09:51:53.330670 IP 10.1.1.10.26125 > 10.1.1.70.2055: UDP, length 1412
09:51:53.330672 IP 10.1.1.10.26125 > 10.1.1.70.2055: UDP, length 1364
09:51:53.330718 IP 10.1.1.10.26125 > 10.1.1.70.2055: UDP, length 1412
09:51:53.330818 IP 10.1.1.10.26125 > 10.1.1.70.2055: UDP, length 1364
09:51:53.330821 IP 10.1.1.10.26125 > 10.1.1.70.2055: UDP, length 360`

**Comment by wastemans** [comment]
Doesn't work with softflowd from a completely different host either, though the packets arrive all the time.
